{
  "schema_version": "0.1",
  "workspace": ".",
  "source": {
    "path": "source.png",
    "original_path": "",
    "width": 0,
    "height": 0,
    "mode": "",
    "format": ""
  },
  "regions": [],
  "models": [],
  "masks": [],
  "objects": [],
  "backgrounds": [],
  "exports": [],
  "enhanced": [],
  "operations": []
}
