{
  "schema_version": "0.1",
  "workspace": "docs/image-objects/product-card-hero",
  "source": {
    "path": "source.png",
    "original_path": "assets/raw/product-card-hero.jpg",
    "width": 1536,
    "height": 1024,
    "mode": "RGB",
    "format": "JPEG"
  },
  "regions": [
    {
      "id": "region_001",
      "type": "bbox",
      "bbox": [214, 96, 1288, 938],
      "label": "产品主体区域",
      "notes": "用于生成主体 mask 和 cutout",
      "thumbnail": "preview-cache/thumb_region_001.png",
      "export_defaults": {
        "transparent": true,
        "corner_radius": 0,
        "padding": 0,
        "crop_mode": "bbox",
        "format": "png"
      }
    }
  ],
  "models": [
    {
      "backend": "rembg",
      "model": "birefnet-general",
      "profile": "quality",
      "status": "used",
      "used_at": "2026-05-24T12:00:00Z"
    }
  ],
  "masks": [
    {
      "id": "mask_001",
      "region_id": "region_001",
      "path": "masks/mask_001.png",
      "source": "rembg-region",
      "bbox": [214, 96, 1288, 938],
      "region_bbox": [214, 96, 1288, 938],
      "model": "birefnet-general",
      "notes": "主体产品 mask"
    }
  ],
  "objects": [
    {
      "id": "obj_001",
      "region_id": "region_001",
      "path": "cutouts/obj_001-product.png",
      "mask_id": "mask_001",
      "bbox": [214, 96, 1288, 938],
      "size": [1074, 842],
      "name": "产品主体",
      "intent": "用于 H5 首屏视觉素材",
      "notes": "保留原始高光和品牌标识"
    }
  ],
  "backgrounds": [],
  "exports": [
    {
      "id": "export_001",
      "object_id": "obj_001",
      "path": "exports/export_001-product-transparent.png",
      "size": [1106, 874],
      "transparent": true,
      "background": null,
      "corner_radius": 0,
      "padding": 16,
      "crop_mode": "bbox",
      "format": "png",
      "notes": "透明交付版"
    }
  ],
  "enhanced": [
    {
      "id": "enh_001",
      "source_object_id": "obj_001",
      "path": "enhanced/enh_001-product-edge-polish.png",
      "source": "aisee-design-assets",
      "method": "image-gen-edit",
      "prompt_ref": "enhanced/enh_001-brief.md",
      "style_lock": {
        "preserve_brand": true,
        "preserve_unmasked_area": true,
        "preserve_lighting": true
      },
      "status": "candidate",
      "notes": "边缘与材质细节优化候选"
    }
  ],
  "operations": [
    {
      "id": "op_001",
      "kind": "init",
      "status": "success",
      "created_at": "2026-05-24T11:58:00Z",
      "params": {
        "input": "assets/raw/product-card-hero.jpg",
        "force": false
      },
      "outputs": ["source.png", "source.json"]
    }
  ]
}
